"That's why, when reports emerged last spring that the Internal Revenue Service was targeting conservative groups applying for a certain tax-exempt status, fair-minded folks of all political stripes expressed outrage.",right
"Far from being a fringe conspiracy theory, the discovery of government-sanctioned bias against conservative organizations requesting 501(c)(4) status was reported by none other than the IRS' own inspector general.",right
"Since that discovery, several IRS employees - including the acting commissioner - have resigned, and the House of Representatives, the Senate and the Department of Justice are each conducting investigations.",right
"But despite the scorching questioning of IRS leaders and well-founded condemnation from all corners, the agency still has not learned its lesson on impartiality.",right
"What the IRS can't do with permission it seems determined to do by fiat.",right
"On Nov. 29, 2013, the agency published a proposed rule that would further trample on the free-speech rights of 501(c)(4) organizations and restrict their activities.",right
"The rule singles out the same conservative groups previously targeted by the IRS and threatens to limit their participation in a host of advocacy and educational activities, even nonpartisan voter-registration and education drives.",right
"These activities have a clear role in promoting civic engagement and social welfare - the exact purpose of the 501(c)(4) designation.",right
"The IRS' proposed rule would force groups such as the National Taxpayers Union and the American Civil Liberties Union to quit such activities or risk losing their tax-exempt status.",right
"Proponents of the rule claim it is necessary to clear up confusion about tax exemption and to bring greater transparency to political spending.",right
"This is little more than a convenient cover to quiet conservative critics while leaving others free to engage in political discourse.",right
"The administration should pay attention to the liberal groups denouncing this proposed rule and its detrimental impact.",right
"The ACLU slammed the rule as producing the same structural issues at the IRS that led to the use of inappropriate criteria in the selection of various charitable and social welfare groups for undue scrutiny.",right
"The Alliance for Justice Action Campaign and even the Sierra Club have been equally critical.",right
"In three months, more than 140,000 comments were submitted, the most for any rule-making.",right
"To halt this latest attempt to quash free speech, I introduced the Stop Targeting of Political Beliefs by the IRS Act, which would prohibit for one year the finalization of this proposed rule.",right
"It would also prevent additional targeting of 501(c)(4) groups by restoring the IRS standards and definitions that were in place before the agency began going after conservative organizations.",right
"The House of Representatives recently passed an identical bill, and the Senate legislation already has 40 co-sponsors.",right
"It deserves the support of the full Senate.",right
"However, Democrats have refused to allow the bill to come to the floor for debate and a vote.",right
"And President Obama has issued a veto threat against it.",right
"That threat is a clearly disproportionate response to legislation aimed at protecting free-speech rights of conservatives and liberals alike.",right
"It also demonstrates how badly the Obama administration wants to sweep this problem under the rug while silencing any remaining critics.",right
"My bill is simple and fair: It merely suspends new IRS rule-making regarding 501(c)(4) groups until the ongoing investigations are completed.",right
"When a powerful government agency has a problem with bias and abuse, that's exactly what Congress should be doing - and the least the public should expect - until this issue is resolved.",right
"Nowhere else in the country are people more keenly aware of the value of water than here in the desert Southwest.",right
"It's the lifeblood of our communities.",right
"Yet growing demands on shared water supplies have generated intense interest and regional tensions.",right
"Throughout our country and around the world, water continues to be one of the most important issues of our time.",right
"That is why I am pleased to announce that on Saturday, World Water Day, I am launching a yearlong conversation on domestic and international water issues.",right
"This project will focus on bringing attention to water-security challenges with an eye toward identifying effective policies that could inform water-management decisions.",right
"I look forward to tapping the reservoir of expertise we have in Arizona at the Department of Water Resources, the University of Arizona's Water Resource Research Center, and Arizona State University's Morrison Institute, among others.",right
"For more than a century, Arizona has been on the cutting edge of water management, and our breadth of experience will ensure we can successfully tackle the water challenges ahead.",right
"Arizona as we know it today is due in large part to the historic vision that led to the development of the Salt River Project, construction of Roosevelt Dam and creation of the Central Arizona Project.",right
"We continued with the passage of prudent conservation policies such as the Groundwater Management Code.",right
"Because we are home to 22 federally recognized American Indian tribes, we have also had the opportunity to work on mutually beneficial water settlements.",right
"Our location along the border has enabled us to be a part of water treaty negotiations with Mexico.",right
"This diverse set of water challenges, and Arizona's know-how in addressing them, will serve as a valuable resource for the rest of the United States and the world.",right
"With recent events in California and continued attention on global water scarcity in Africa and elsewhere, it is clear the time for a conversation about water policy is now.",right
"Hundreds of millions of people at home and abroad face issues with access to safe drinking water, sanitation and hygiene.",right
"Thankfully, leaders like Gov.",right
"Jan Brewer and former Sen. Jon Kyl, along with others in the water community, have helped pave the way to address these problems in Arizona.",right
"With the release of Arizona's Strategic Water Vision in January and Kyl's work with the Morrison Institute to refine that discussion, the state is proactively looking at ways to plan our future.",right
"My hope is to build on those efforts, and better understand how our local solutions might inform federal policy.",right
"I am pleased to say our experience has shown the best solutions to these problems are driven by water managers at the local level.",right
"We are fortunate in Arizona to have some of the best leaders and best water-management practices in the world.",right
"The domestic and international challenges related to this issue are real; now is the time to understand them and advance better water policies.",right
"I look forward to getting started.As we approach the Oct. 1 deadline when Obamacare begins to go into effect, it becomes more and more evident that the president's health-care law is not ready for prime time.",right
"Through our congressional oversight and the feedback we get from businesses and families around the country on a daily basis, we have seen just how frustrated people are with the impact Obamacare is having on their lives.",right
"It has become very clear that this law is unworkable.",right
"A CNN poll last week shows support for the president's health-care law waning, with only 39 percent of Americans now in favor of Obamacare, down from 51 percent in January.",right
"With the Obama administration's decisions to delay several parts of the health-care law, including the employer mandate, it is clear that even the White House now recognizes what the rest of America already knows: Obamacare is a train wreck.",right
"Businesses small and large across our states have shared stories about the burdens Obamacare is placing on them.",right
"Couple that with the most recent jobs numbers from the Bureau of Labor Statistics, and it is difficult not to conclude that Obamacare is having a dampening effect on the country's economy.",right
"That is why we have introduced legislation that would delay all Obamacare provisions and taxes for one year.",right
"H.R.",right
"2809 and S. 1490 seek to postpone all provisions of the Affordable Care Act taking effect on Jan. 1, 2014 or later by one year from the date of enactment.",right
"Delaying Obamacare is a necessary step in our efforts to get this law off the books and replace it with real health-care solutions that work for American families and businesses.",right
"It builds on efforts already taken by the House and Senate to delay both the individual and employer mandates.",right
"In fairness to American taxpayers, the best thing we can do right now is to implement a one-year delay so we can continue to chip away at this disastrous law.",right
"Postponing Obamacare gives us the best chance to defund it.",right
"If we delay the law, the administration will be unable to collect new taxes, provide subsidies or expand Medicaid -- all things that put taxpayers further on the hook.",right
"As Republicans continue to work to implement real health-care solutions for Americans, our legislation is the right step to take.",right
"In fairness to taxpayers, our best option today is to delay Obamacare's implementation for one year and continue to work to enact policies that put patients and doctors in charge of health care and do not require trillions of dollars of taxpayer money.",right
"When I was a graduate student and Senate intern in the late 1980s, my master's thesis proved to be a rather shallow attempt to explain Robert Mugabe's hold on the Zimbabwean electorate nearly a decade removed from independence.",right
"Twenty-five years later, that hold on the electorate has long since been exposed as brute force and chicanery.",right
"What is left to explain is Mugabe's mystifying hold on the rest of Africa.",right
"Western media and election observers were notably - and forcibly - absent during Zimbabwe's July 31 contest, but there was a robust presence by Southern African Development Community (SADC) and African Union (AU) election observers.",right
"Nevertheless, despite clear, abundant and still-mounting evidence of a deeply flawed election process, SADC and the AU seem eager to give Mugabe and his ZANU-PF party a pass.",right
"While final reports have yet to be issued, SADC's has already declared the Zimbabwe election free and peaceful, and the AU has affirmed it as credible.",right
"Note the absence of the word fair.",right
"But why quibble?",right
"The whole of Africa is sending us messages of congratulations to say 'well done,'  was Mugabe's interpretation.",right
"And who can blame him.",right
"That Zimbabwe would have another deeply flawed election is not news to anyone who has followed Mugabe's ham-handed rule over the past 33 years.",right
"But to those who are hoping that Africa is indeed turning the corner in terms of politics and governance, such a response in the wake of the election is deeply concerning.",right
"There is much to commend in the founding charters and principles of both SADC and the AU.",right
"Cooperation and coordination through these institutions has strengthened individual economies and provided a useful tool to address cross-border and regional security and governance issues.",right
"The potential for future collaboration is even greater.",right
"Which is why it is so puzzling that SADC and the AU would so willingly jettison their own principles when it comes to elections in Zimbabwe.",right
"Again, this is not an example of the West holding nascent democracies to unreasonably high electoral standards.",right
"It is simply a matter of asking SADC and the AU to abide by their own standards and live up to their own charters.",right
"SADC's Principles and Guidelines Governing Democratic Elections provide for its observer role during member state elections, to ensure full participation of the citizens in the political process by certifying, among other things, the existence of [an] updated and accessible voters roll.",right
"Such rolls were neither updated nor accessible during the Zimbabwe elections.",right
"Likewise, the AU's Guidelines for Electoral Observations call for competent accountable electoral institutions to take all necessary measures to ensure such essentials as equal access to public media by competing parties.",right
"There was not even a pretense of equal access to state media during Zimbabwe's election season.",right
"In the founding document of the New Partnership for Africa's Development, African heads of state hailed the emergence of democratic regimes and committed African leaders to take responsibility for promoting human rights ... by developing clear standards of accountability, transparency and participatory governance.",right
"In the context of observing the Zimbabwe elections, only Botswana has been willing to take such responsibility.",right
"Botswana decried Zimbabwe's elections as not free and fair and warned that SADC should not create the undesirable precedent of permitting exceptions to its own rules.",right
"Unfortunately, Zimbabwe's course seems set for the near future.",right
"By the time official reports on the election are issued, ZANU-PF will have formed a new government.",right
"The Zimbabwean courts are unlikely to intervene, and Mugabe will go on making empty speeches about liberation while Zimbabwe, unable to feed itself and having lost its own currency, erodes its independence by the day.",right
"The final reports issued by SADC and the AU won't tell us anything we don't already know about Zimbabwe, but they will say a great deal about the direction that southern Africa as a region, and Africa as a whole, is headed.",right
"Will African leaders be true to their own undertakings and stand for the principles they have espoused, or will they bow to the knee of a desperate old man determined to keep himself in power no matter the cost to the citizens he claims to represent?",right
"After winning election to the U.S. Senate last year, I expected to be teaming up often with my fellow conservative Marco Rubio (R., Fla.).",right
"What I never expected was that Senator Rubio and I would be working on immigration-reform legislation with liberals like Chuck Schumer (D., N.Y.) and Dick Durbin (D., Ill.).",right
"While conservatives are justified in their skepticism of any legislation that Senators Schumer and Durbin sign off on, I hope we don't let their association with the bill that is now before the Senate overshadow the conservative elements that Republicans have included.",right
"The first section of the bill addresses border security.",right
"It requires the Department of Homeland Security (DHS) to develop a Comprehensive Southern Border Security Strategy and appropriates $3 billion to implement the plan with resources such as military-developed surveillance systems, additional Border Patrol and customs agents, and unmanned and fixed-wing aircraft.",right
"DHS is also required to develop the Southern Border Fencing Strategy, with $1.5 billion to ensure that all parts of the border that need a fence have a fence (some parts of the border are so mountainous that a fence would be impractical and redundant).",right
"Because DHS hasn't always addressed the situation at the border realistically, the bill requires that if they do not achieve a 90 percent effectiveness rate within five years (meaning that 9 of every 10 illegal border crossers is apprehended), another $2 billion will be spent to implement recommendations from a commission of border stakeholders, who, for the first time, will have meaningful authority to increase border security.",right
"This funding can be directed toward more manpower, technology, and infrastructure strategies.",right
"Additionally, the bill takes strategies and resources that have been effective in certain parts of the border and expands them to the entire border.",right
"Among these are 3,500 new customs agents, authorization to deploy the National Guard at the border, funding for more border-crossing prosecutions, increased funding for Operation Stonegarden (a program of DHS grants to local law-enforcement agencies to improve border security), more Border Patrol stations and forward operating bases, access to all federal lands, funding for improved radio communications in isolated parts of the border, reauthorized funding for the State Criminal Alien Assistance Program (to reimburse state and local law-enforcement agencies for jailing illegal immigrants), and deployment of Department of Defense border radar equipment.",right
"Another conservative concern with potential immigration reform has been the issue of amnesty.",right
"This bill ensures that no illegal immigrant will be given amnesty or rewarded for illegal behavior.",right
"In fact, no illegal immigrant will be given anything.",right
"Before any illegal immigrant can adjust to a non-citizenship provisional status, DHS must have submitted the border-security and border-fencing strategies.",right
"Only then will these immigrants be able to legally work in the country -- but they will not be eligible for government assistance (unemployment, welfare, Obamacare, etc.).",right
"Moreover, to be eligible for this non-citizenship provisional status, illegal immigrants must pay a $500 fine, pass a background check, and pay fees.",right
"And before most illegal immigrants can adjust from this provisional status to being lawful permanent residents, the border-security and border-fencing strategies will have to be operational and functioning.",right
"Additionally, every employer in the country will have to use the E-Verify system to check the immigration status of every employee hire.",right
"E-Verify is in use in Arizona, but this bill will make it mandatory across the country.",right
"Only after ten years can these provisional-status immigrants apply for a green card (which is still short of U.S. citizenship).",right
"In order to earn a green card, they will have to pay all back taxes, maintain employment in the U.S., learn English and civics, and wait until everyone who applied for a green card before them has been processed.",right
"It will likely be close to 13 years before current illegal immigrants begin to become eligible for citizenship.",right
"It is a long and difficult path, but even though some law-abiding and productive members of our society will eventually earn that opportunity, not all of them will take it.",right
"Other measures important to conservatives, like an overhaul of the legal-immigration system with a shift to a more merit-based process and a more robust temporary-worker program, are also included in the bill.",right
"Conservatives worried that President Obama or Secretary Napolitano will be able to expedite the legalization sections of the bill while dragging their feet on border security should consider that the border-security measures come first, while the status-adjustment portions of the bill will take many years.",right
"It's also worth noting that it's likely that this process will occur under both Democratic and Republicans administrations.",right
"As this bill moves through regular order and is debated and amended, conservatives may not always agree on every aspect.",right
"But I think we can all agree that the status quo is unacceptable, and I'm convinced that this legislation moves us in a positive direction.",right
"When thinking of an event that occurs every four years, the Olympics usually come to mind.",right
"Not the introduction of a federal budget.",right
"But such was the case a few weeks ago.",right
"Earlier in March, the introduction of the federal budget became an event of Olympic proportions and timing when Senate Democrats released their first budget proposal in four years.",right
"While I have to give Senate Democrats some credit for actually offering their first budget in over 1440 days, I prefer budgets that actually balance at some point.",right
"Needless to say, I voted against this budget.",right
"More than $100 billion in new spending is included in the Senate Democrats' budget.",right
"These funds are dedicated for economic stimulus in the form of infrastructure spending and job training, which includes funds to help accurately predict weather patterns.",right
"How about a complimentary forecast: By the end of this budget's 10-year window in 2023, more than $2 trillion in spending increases will occur - that's an increase of 62 percent over fiscal year 2013 federal spending.",right
"All of these numbers amount to $7.3 trillion in new debt by 2023.",right
"That's nearly $21,000 of NEW debt for every man, woman and child in the United States.",right
"One has to wonder when the debt crisis becomes an actual crisis.",right
"It is tough to fathom, but the Senate Democratic budget accumulates $7.3 trillion in new debt despite the $1.5 trillion in new tax hikes it imposes.",right
"This budget doesn't come close to balancing because their massive tax increases are wiped out by even more massive spending increases.",right
"Not surprisingly, the budget also fails to rein in the real drivers of our debt: entitlement programs.",right
"By contrast, the House Republicans' budget put forth by House Budget Committee Chairman Paul Ryan contains no tax increases, includes twice as much deficit reduction over 10 years as the Senate Democratic budget, and actually balances by 2023.",right
"The Ryan budget also begins to make entitlement programs solvent for the long-term.",right
"It reforms Medicare by offering a range of insurance plans such as private insurance or traditional fee-for-service Medicare, and increases means testing for Medicare, among other reforms.",right
"It is simply irresponsible to put forth budgets that jack up taxes on today's workers while ignoring the insolvency of the very programs these workers pay for and that many will rely on in the future.",right
"By making reforms to these programs now, we can ensure that changes will not affect anyone currently receiving benefits or those nearing retirement age.",right
"On the tax front, the Ryan budget not only avoids tax increases, it repeals the Alternative Minimum Tax, which notoriously hits the middle class the hardest; and it reduces the U.S. corporate tax rate - currently the highest in the world - to 25 percent.",right
"The Ryan budget is a responsible, serious budget that will foster economic growth.",right
"By contrast, the Senate Democratic budget, with its tax hikes and billions in spending increases, will only keep us on the same fiscally irresponsible and economically damaging path.",right
"We must work toward a final budget that significantly reduces federal spending and doesn't include burdensome tax increases, while also keeping in mind that the real drivers of our debt, our entitlement programs, must be reformed to ensure they're around for future generations.",right
"Both the Ryan budget and the Senate Democratic budget passed their respective houses of Congress, and President Obama recently introduced his own budget proposal.",right
"The House and Senate Appropriations Committees will soon negotiate the terms for federal spending described in each of the budget proposals.",right
"When this process starts, prepare to watch the real Olympic-sized budget games begin.",right
"Last month, a bipartisan group of U.S.",right
"Senators, the so-called Gang of Eight, offered a framework to address immigration reform.",right
"I'm proud to be a member of the group, along with Senators McCain (R-AZ), Schumer (D-NY), Graham (R-SC), Durbin (D-IL), Rubio (R-FL), Menendez (D-NJ), and Bennet (D-CO).",right
"Our proposal contains four major elements: securing the border before offering a pathway to citizenship for illegal immigrants, reforming our legal immigration system to encourage economic growth, creating a temporary worker program to provide access to future labor, and strengthening employment verification standards to prevent the hiring of illegal immigrants.",right
"One reason immigration reform failed in the past is because of the public's understandable mistrust of the federal government to adequately address border security.",right
"That mistrust is especially relevant now, with drug and human smuggling rings clashing along the border.",right
"Fortunately, the federal government has a model of what a secure border looks like.",right
"In the Yuma Sector, spanning 126 miles of the border, we have operational control, meaning that if someone attempts to cross the border, there's a reasonable expectation they will be apprehended.",right
"However, in the Tucson Sector, which is responsible for 262 miles of the border, we have nothing close to operational control.",right
"The framework creates a commission made up of border state governors, attorneys general, and citizens who live and work along the border that will make recommendations as to what constitutes a secure border.",right
"The federal government's failure to secure the border affects these citizens more than anyone else in the country, so because of their expertise and experiences, they should have input in defining what a secure border looks like.",right
"Only after the border is secured can illegal immigrants begin the arduous, albeit fair, process of applying for citizenship.",right
"A pathway to citizenship has been, and continues to be, the most contentious element of immigration reform proposals.",right
"There are some Republicans who believe that anything short of rounding-up illegal immigrants and sending them back to their home countries is an amnesty.",right
